{
  "fixture_id": "fa_req_006",
  "eval_set_id": "requirement_extraction_eval_v1",
  "language": "fa",
  "project_type": "landing",
  "input": {
    "context_version": 1,
    "context_items": [
      {
        "context_item_id": "fa_req_006_ctx_1",
        "item_type": "decision",
        "content": "اقدام اصلی صفحه ثبت‌نام رایگان باشد.",
        "source_refs": [
          {
            "source_id": "fa_req_006_src_a",
            "source_version_id": "fa_req_006_src_a_v1"
          }
        ],
        "status": "confirmed"
      },
      {
        "context_item_id": "fa_req_006_ctx_2",
        "item_type": "decision",
        "content": "اقدام اصلی صفحه خرید اشتراک باشد.",
        "source_refs": [
          {
            "source_id": "fa_req_006_src_a",
            "source_version_id": "fa_req_006_src_a_v1"
          }
        ],
        "status": "confirmed"
      },
      {
        "context_item_id": "fa_req_006_ctx_3",
        "item_type": "unknown",
        "content": "تعارض اقدام اصلی هنوز حل نشده است.",
        "source_refs": [
          {
            "source_id": "fa_req_006_src_a",
            "source_version_id": "fa_req_006_src_a_v1"
          }
        ],
        "status": "confirmed"
      }
    ]
  },
  "expected_output": {
    "requirements": [
      {
        "gold_requirement_id": "fa_req_006_req_1",
        "title": "اقدام ثبت‌نام رایگان",
        "description": "صفحه باید ثبت‌نام رایگان را به‌عنوان اقدام اصلی ارائه کند.",
        "category": "functional",
        "priority": "must",
        "source_refs": [
          {
            "source_id": "fa_req_006_src_a",
            "source_version_id": "fa_req_006_src_a_v1"
          }
        ],
        "is_unsupported": false,
        "critical_for_scope": true
      },
      {
        "gold_requirement_id": "fa_req_006_req_2",
        "title": "اقدام خرید اشتراک",
        "description": "صفحه باید خرید اشتراک را به‌عنوان اقدام اصلی ارائه کند.",
        "category": "functional",
        "priority": "must",
        "source_refs": [
          {
            "source_id": "fa_req_006_src_a",
            "source_version_id": "fa_req_006_src_a_v1"
          }
        ],
        "is_unsupported": false,
        "critical_for_scope": true
      }
    ]
  },
  "evaluation_annotations": {
    "candidate_annotations": [
      {
        "candidate_id": "fa_req_006_cand_1",
        "gold_requirement_id": "fa_req_006_req_1",
        "semantically_unsupported": false,
        "critical_for_scope": true
      },
      {
        "candidate_id": "fa_req_006_cand_2",
        "gold_requirement_id": "fa_req_006_req_2",
        "semantically_unsupported": false,
        "critical_for_scope": true
      }
    ],
    "deterministic_output_candidate_ids": [
      "fa_req_006_cand_1",
      "fa_req_006_cand_2"
    ],
    "semantic_duplicate_groups": []
  },
  "metadata": {
    "synthetic": true,
    "segment": "contradictory",
    "difficulty": "hard",
    "phenomena": [
      "conflict",
      "primary_cta"
    ],
    "fixture_version": "1"
  }
}
