{
  "fixture_id": "fa_req_017",
  "eval_set_id": "requirement_extraction_eval_v1",
  "language": "fa",
  "project_type": "landing",
  "input": {
    "context_version": 1,
    "context_items": [
      {
        "context_item_id": "fa_req_017_ctx_1",
        "item_type": "decision",
        "content": "هدف اصلی افزایش درخواست دموی محصول است.",
        "source_refs": [
          {
            "source_id": "fa_req_017_src_a",
            "source_version_id": "fa_req_017_src_a_v1"
          }
        ],
        "status": "confirmed"
      },
      {
        "context_item_id": "fa_req_017_ctx_2",
        "item_type": "constraint",
        "content": "اقدام درخواست دمو در بخش نخست صفحه دیده شود.",
        "source_refs": [
          {
            "source_id": "fa_req_017_src_a",
            "source_version_id": "fa_req_017_src_a_v1"
          }
        ],
        "status": "confirmed"
      }
    ]
  },
  "expected_output": {
    "requirements": [
      {
        "gold_requirement_id": "fa_req_017_req_1",
        "title": "تمرکز بر درخواست دمو",
        "description": "ساختار صفحه باید کاربر را به ثبت درخواست دمو هدایت کند.",
        "category": "business",
        "priority": "must",
        "source_refs": [
          {
            "source_id": "fa_req_017_src_a",
            "source_version_id": "fa_req_017_src_a_v1"
          }
        ],
        "is_unsupported": false,
        "critical_for_scope": true
      },
      {
        "gold_requirement_id": "fa_req_017_req_2",
        "title": "نمایش اقدام دمو در بخش نخست",
        "description": "اقدام درخواست دمو باید در بخش نخست صفحه قابل مشاهده باشد.",
        "category": "visual",
        "priority": "must",
        "source_refs": [
          {
            "source_id": "fa_req_017_src_a",
            "source_version_id": "fa_req_017_src_a_v1"
          }
        ],
        "is_unsupported": false,
        "critical_for_scope": true
      }
    ]
  },
  "evaluation_annotations": {
    "candidate_annotations": [
      {
        "candidate_id": "fa_req_017_cand_1",
        "gold_requirement_id": "fa_req_017_req_1",
        "semantically_unsupported": false,
        "critical_for_scope": true
      },
      {
        "candidate_id": "fa_req_017_cand_2",
        "gold_requirement_id": "fa_req_017_req_2",
        "semantically_unsupported": false,
        "critical_for_scope": true
      }
    ],
    "deterministic_output_candidate_ids": [
      "fa_req_017_cand_1",
      "fa_req_017_cand_2"
    ],
    "semantic_duplicate_groups": []
  },
  "metadata": {
    "synthetic": true,
    "segment": "clear",
    "difficulty": "intermediate",
    "phenomena": [
      "conversion_goal",
      "business"
    ],
    "fixture_version": "1"
  }
}
