{
  "fixture_id": "fa_req_001",
  "eval_set_id": "requirement_extraction_eval_v1",
  "language": "fa",
  "project_type": "landing",
  "input": {
    "context_version": 1,
    "context_items": [
      {
        "context_item_id": "fa_req_001_ctx_1",
        "item_type": "fact",
        "content": "پروژه یک لندینگ فارسی برای کافه است.",
        "source_refs": [
          {
            "source_id": "fa_req_001_src_a",
            "source_version_id": "fa_req_001_src_a_v1"
          }
        ],
        "status": "confirmed"
      },
      {
        "context_item_id": "fa_req_001_ctx_2",
        "item_type": "decision",
        "content": "اقدام اصلی صفحه رزرو میز است.",
        "source_refs": [
          {
            "source_id": "fa_req_001_src_a",
            "source_version_id": "fa_req_001_src_a_v1"
          }
        ],
        "status": "confirmed"
      }
    ]
  },
  "expected_output": {
    "requirements": [
      {
        "gold_requirement_id": "fa_req_001_req_1",
        "title": "امکان رزرو میز",
        "description": "صفحه باید اقدام مشخصی برای شروع فرایند رزرو میز ارائه کند.",
        "category": "functional",
        "priority": "must",
        "source_refs": [
          {
            "source_id": "fa_req_001_src_a",
            "source_version_id": "fa_req_001_src_a_v1"
          }
        ],
        "is_unsupported": false,
        "critical_for_scope": true
      }
    ]
  },
  "evaluation_annotations": {
    "candidate_annotations": [
      {
        "candidate_id": "fa_req_001_cand_1",
        "gold_requirement_id": "fa_req_001_req_1",
        "semantically_unsupported": false,
        "critical_for_scope": true
      }
    ],
    "deterministic_output_candidate_ids": [
      "fa_req_001_cand_1"
    ],
    "semantic_duplicate_groups": []
  },
  "metadata": {
    "synthetic": true,
    "segment": "clear",
    "difficulty": "basic",
    "phenomena": [
      "primary_cta",
      "functional"
    ],
    "fixture_version": "1"
  }
}
