{
  "fixture_id": "fa_req_013",
  "eval_set_id": "requirement_extraction_eval_v1",
  "language": "fa",
  "project_type": "portfolio",
  "input": {
    "context_version": 1,
    "context_items": [
      {
        "context_item_id": "fa_req_013_ctx_1",
        "item_type": "decision",
        "content": "نمونه‌کارها به فارسی و انگلیسی ارائه شوند.",
        "source_refs": [
          {
            "source_id": "fa_req_013_src_a",
            "source_version_id": "fa_req_013_src_a_v1"
          }
        ],
        "status": "confirmed"
      },
      {
        "context_item_id": "fa_req_013_ctx_2",
        "item_type": "unknown",
        "content": "روش انتخاب زبان مشخص نشده است.",
        "source_refs": [
          {
            "source_id": "fa_req_013_src_a",
            "source_version_id": "fa_req_013_src_a_v1"
          }
        ],
        "status": "confirmed"
      }
    ]
  },
  "expected_output": {
    "requirements": [
      {
        "gold_requirement_id": "fa_req_013_req_1",
        "title": "محتوای دوزبانه نمونه‌کارها",
        "description": "محتوای نمونه‌کارها باید به فارسی و انگلیسی قابل ارائه باشد.",
        "category": "technical",
        "priority": "should",
        "source_refs": [
          {
            "source_id": "fa_req_013_src_a",
            "source_version_id": "fa_req_013_src_a_v1"
          }
        ],
        "is_unsupported": false,
        "critical_for_scope": true
      }
    ]
  },
  "evaluation_annotations": {
    "candidate_annotations": [
      {
        "candidate_id": "fa_req_013_cand_1",
        "gold_requirement_id": "fa_req_013_req_1",
        "semantically_unsupported": false,
        "critical_for_scope": true
      }
    ],
    "deterministic_output_candidate_ids": [
      "fa_req_013_cand_1"
    ],
    "semantic_duplicate_groups": []
  },
  "metadata": {
    "synthetic": true,
    "segment": "incomplete",
    "difficulty": "intermediate",
    "phenomena": [
      "multilingual",
      "technical"
    ],
    "fixture_version": "1"
  }
}
