{
  "fixture_id": "fa_req_016",
  "eval_set_id": "requirement_extraction_eval_v1",
  "language": "fa",
  "project_type": "corporate",
  "input": {
    "context_version": 1,
    "context_items": [
      {
        "context_item_id": "fa_req_016_ctx_1",
        "item_type": "assumption",
        "content": "سامانه بدون هیچ آزمونی سریع‌ترین تجربه بازار را خواهد داشت.",
        "source_refs": [
          {
            "source_id": "fa_req_016_src_a",
            "source_version_id": "fa_req_016_src_a_v1"
          }
        ],
        "status": "proposed"
      },
      {
        "context_item_id": "fa_req_016_ctx_2",
        "item_type": "unknown",
        "content": "هیچ معیار یا شاهدی برای سریع‌ترین بودن ثبت نشده است.",
        "source_refs": [
          {
            "source_id": "fa_req_016_src_a",
            "source_version_id": "fa_req_016_src_a_v1"
          }
        ],
        "status": "confirmed"
      }
    ]
  },
  "expected_output": {
    "requirements": [
      {
        "gold_requirement_id": "fa_req_016_req_1",
        "title": "سریع‌ترین تجربه بازار",
        "description": "سامانه باید سریع‌ترین تجربه موجود در بازار را تضمین کند.",
        "category": "technical",
        "priority": "must",
        "source_refs": [
          {
            "source_id": "fa_req_016_src_a",
            "source_version_id": "fa_req_016_src_a_v1"
          }
        ],
        "is_unsupported": true,
        "critical_for_scope": true
      }
    ]
  },
  "evaluation_annotations": {
    "candidate_annotations": [
      {
        "candidate_id": "fa_req_016_cand_1",
        "gold_requirement_id": "fa_req_016_req_1",
        "semantically_unsupported": true,
        "critical_for_scope": true
      }
    ],
    "deterministic_output_candidate_ids": [
      "fa_req_016_cand_1"
    ],
    "semantic_duplicate_groups": []
  },
  "metadata": {
    "synthetic": true,
    "segment": "unsupported",
    "difficulty": "hard",
    "phenomena": [
      "unsupported_assumption",
      "critical_detection"
    ],
    "fixture_version": "1"
  }
}
