{
  "fixture_id": "fa_req_018",
  "eval_set_id": "requirement_extraction_eval_v1",
  "language": "fa",
  "project_type": "corporate",
  "input": {
    "context_version": 1,
    "context_items": [
      {
        "context_item_id": "fa_req_018_ctx_1",
        "item_type": "constraint",
        "content": "فقط رنگ‌های مصوب هویت بصری برند استفاده شوند.",
        "source_refs": [
          {
            "source_id": "fa_req_018_src_a",
            "source_version_id": "fa_req_018_src_a_v1"
          }
        ],
        "status": "confirmed"
      },
      {
        "context_item_id": "fa_req_018_ctx_2",
        "item_type": "reference",
        "content": "راهنمای هویت بصری مرجع انتخاب رنگ است.",
        "source_refs": [
          {
            "source_id": "fa_req_018_src_a",
            "source_version_id": "fa_req_018_src_a_v1"
          }
        ],
        "status": "confirmed"
      }
    ]
  },
  "expected_output": {
    "requirements": [
      {
        "gold_requirement_id": "fa_req_018_req_1",
        "title": "رعایت رنگ‌های هویت بصری",
        "description": "رابط باید فقط از رنگ‌های مصوب راهنمای هویت بصری استفاده کند.",
        "category": "visual",
        "priority": "must",
        "source_refs": [
          {
            "source_id": "fa_req_018_src_a",
            "source_version_id": "fa_req_018_src_a_v1"
          }
        ],
        "is_unsupported": false,
        "critical_for_scope": true
      }
    ]
  },
  "evaluation_annotations": {
    "candidate_annotations": [
      {
        "candidate_id": "fa_req_018_cand_1",
        "gold_requirement_id": "fa_req_018_req_1",
        "semantically_unsupported": false,
        "critical_for_scope": true
      }
    ],
    "deterministic_output_candidate_ids": [
      "fa_req_018_cand_1"
    ],
    "semantic_duplicate_groups": []
  },
  "metadata": {
    "synthetic": true,
    "segment": "clear",
    "difficulty": "basic",
    "phenomena": [
      "brand",
      "visual"
    ],
    "fixture_version": "1"
  }
}
